id,What is your age?,What is your gender?,What is your current major or job field?,What is your current role?,How many years of programming experience do you have?,Languages_Used,Python_Community_Support,Python_Optimization_Challenges,Python_Learning_Challenges,Java_Community_Support,Java_Optimization_Challenges,Java_Learning_Challenges,R_Community_Support,R_Optimization_Challenges,R_Learning_Challenges,Which language do you use most frequently?,  Which language do you prefer for the following tasks?   [Data Science & Machine Learning],  Which language do you prefer for the following tasks?   [Web Development],  Which language do you prefer for the following tasks?   [Mobile App Development],  Which language do you prefer for the following tasks?   [Enterprise Applications],  Which language do you prefer for the following tasks?   [Statistical Analysis],How often do you switch between these languages?,Which language do you perceive as the most efficient for your tasks?,Python_Execution_Speed,R_Execution_Speed,Java_Execution_Speed,Python_Ease_of_Use,R_Ease_of_Use,Java_Ease_of_Use,Python_Documentation,R_Documentation,Java_Documentation,Python_Concurrency_Features,R_Concurrency_Features,Java_Concurrency_Features,Python_Readability,R_Readability,Java_Readability,"How often do you seek help from online resources (e.g., Stack Overflow, official documentation)?",Which language do you think will dominate the job market in the next 5 years?,"If you could only use one of these three languages for all future projects, which would you choose and why?",Thank you for filling out our form! <3,Timestamp,Which language was the easiest for you to learn?,Which language has the most beginner-friendly documentation and learning resources?,"In your field, which language is the most commonly used?",Which language do you believe is most in demand for jobs?,Which language would you recommend for someone entering your industry?,Have you ever contributed to an open-source project in any of these languages?,What do you think is the biggest advantage of your preferred language?,Would you recommend learning another language? Why?,Have you ever had to switch from one of these languages to another due to project requirements? Why?
3.0,18-24,Female,software development professionally using java often,Student,Less than 1 year,Java,Not Applicable,Not Applicable,Not Applicable,5.0,garbage collection overhead is always tricky,initially java's verbose syntax felt really overwhelming and understanding the intricate object oriented concepts took considerable time,Not Applicable,Not Applicable,Not Applicable,All equally,Python,Python,Java,Java,R,3,Java,Not Applicable,Not Applicable,4.0,Not Applicable,Not Applicable,2.0,Not Applicable,Not Applicable,3.0,Not Applicable,Not Applicable,3.0,Not Applicable,Not Applicable,1.0,4,Python,java's my go-to it's versatile and reliable,Not Applicable,Not Applicable,Not Applicable,Not Applicable,Not Applicable,Not Applicable,Not Applicable,Not Applicable,Not Applicable,Not Applicable,Not Applicable
14.0,18-24,Female,software development mainly i work building applications with java its pretty cool stuff though sometimes stressful,Student,1-3 years,Java,Not Applicable,Not Applicable,Not Applicable,3.0,working with java is sometimes slow so i often struggle to find performance bottlenecks in my code,initially the verbose syntax and understanding the class structure were difficult,Not Applicable,Not Applicable,Not Applicable,Java,Python,Python,Java,Python,Python,2,Python,Not Applicable,Not Applicable,3.0,Not Applicable,Not Applicable,2.0,Not Applicable,Not Applicable,4.0,Not Applicable,Not Applicable,4.0,Not Applicable,Not Applicable,2.0,5,Python,java because it's so versatile and i already know it really well plus the large community helps,Not Applicable,Not Applicable,Not Applicable,Not Applicable,Not Applicable,Not Applicable,Not Applicable,Not Applicable,Not Applicable,Not Applicable,Not Applicable
15.0,18-24,Female,software development is my focus i build applications and systems using java for different clients,Student,Less than 1 year,Java,Not Applicable,Not Applicable,Not Applicable,5.0,garbage collection is always a struggle honestly speaking,memorizing the extensive api and grasping the intricacies of object-oriented design presented the most significant hurdles at first,Not Applicable,Not Applicable,Not Applicable,Python,Python,Python,Python,R,R,2,It depends,Not Applicable,Not Applicable,3.0,Not Applicable,Not Applicable,2.0,Not Applicable,Not Applicable,1.0,Not Applicable,Not Applicable,3.0,Not Applicable,Not Applicable,3.0,4,Python,java because i know it best and it's versatile enough to handle most projects i do,Not Applicable,Not Applicable,Not Applicable,Not Applicable,Not Applicable,Not Applicable,Not Applicable,Not Applicable,Not Applicable,Not Applicable,Not Applicable
16.0,18-24,Female,software engineering is my main gig using java for mostly back-end development work right now,Student,Less than 1 year,Java,Not Applicable,Not Applicable,Not Applicable,3.0,garbage collection and memory leaks always make tuning java performance a real headache,okay here's the response:  initially the steep learning curve and understanding the verbose syntax definitely slowed me down,Not Applicable,Not Applicable,Not Applicable,Python,Python,Java,Java,Java,R,4,It depends,Not Applicable,Not Applicable,2.0,Not Applicable,Not Applicable,3.0,Not Applicable,Not Applicable,2.0,Not Applicable,Not Applicable,2.0,Not Applicable,Not Applicable,1.0,2,Python,java definitely its versatility keeps me coming back for most things,Not Applicable,Not Applicable,Not Applicable,Not Applicable,Not Applicable,Not Applicable,Not Applicable,Not Applicable,Not Applicable,Not Applicable,Not Applicable
20.0,18-24,Male,software development is my gig i'm using java a lot and enjoy it mainly working with backend systems right now,Student,Less than 1 year,Java,Not Applicable,Not Applicable,Not Applicable,1.0,garbage collection definitely bites and sometimes figuring out threading issues feels like pulling teeth ugh,the initial setup with all the boilerplate and frameworks seemed pretty overwhelming at first,Not Applicable,Not Applicable,Not Applicable,Java,Python,Java,Java,Python,Java,3,Python,Not Applicable,Not Applicable,4.0,Not Applicable,Not Applicable,1.0,Not Applicable,Not Applicable,1.0,Not Applicable,Not Applicable,3.0,Not Applicable,Not Applicable,4.0,5,Python,java for sure it's just the most versatile and reliable choice for me,Not Applicable,Not Applicable,Not Applicable,Not Applicable,Not Applicable,Not Applicable,Not Applicable,Not Applicable,Not Applicable,Not Applicable,Not Applicable
23.0,18-24,Female,software development is my profession right now i use java daily building applications and solving problems mostly,Student,1-3 years,Java,Not Applicable,Not Applicable,Not Applicable,3.0,garbage collection pauses and memory management plus tuning the jvm itself can really hurt performance,understanding the verbose syntax and the intricacies of the object-oriented paradigm were tough initially.,Not Applicable,Not Applicable,Not Applicable,Python,Python,Python,Java,R,Python,3,Python,Not Applicable,Not Applicable,3.0,Not Applicable,Not Applicable,2.0,Not Applicable,Not Applicable,1.0,Not Applicable,Not Applicable,2.0,Not Applicable,Not Applicable,2.0,4,Python,java i know best obviously,Not Applicable,Not Applicable,Not Applicable,Not Applicable,Not Applicable,Not Applicable,Not Applicable,Not Applicable,Not Applicable,Not Applicable,Not Applicable
28.0,18-24,Female,software engineering mostly java related stuff,Student,1-3 years,Java,Not Applicable,Not Applicable,Not Applicable,4.0,gc tuning and understanding java internals are hard,understanding the complex class structure was difficult really,Not Applicable,Not Applicable,Not Applicable,Python,Java,Java,Python,R,R,5,Python,Not Applicable,Not Applicable,2.0,Not Applicable,Not Applicable,1.0,Not Applicable,Not Applicable,1.0,Not Applicable,Not Applicable,2.0,Not Applicable,Not Applicable,3.0,4,Python,java i guess because it's versatile and i already know it pretty well for diverse projects,Not Applicable,Not Applicable,Not Applicable,Not Applicable,Not Applicable,Not Applicable,Not Applicable,Not Applicable,Not Applicable,Not Applicable,Not Applicable
32.0,18-24,Female,software development is my current gig heavily using java and related technologies within this role,Researcher,7+ years,Java,Not Applicable,Not Applicable,Not Applicable,5.0,garbage collection and memory management always give me trouble,dealing with the verbose syntax and understanding the intricacies of object-oriented design proved tough initially,Not Applicable,Not Applicable,Not Applicable,Python,Python,Python,Python,Java,Java,3,It depends,Not Applicable,Not Applicable,3.0,Not Applicable,Not Applicable,4.0,Not Applicable,Not Applicable,2.0,Not Applicable,Not Applicable,4.0,Not Applicable,Not Applicable,5.0,5,Python,java i guess it's familiar and handles most stuff pretty well for projects i do,Not Applicable,Not Applicable,Not Applicable,Not Applicable,Not Applicable,Not Applicable,Not Applicable,Not Applicable,Not Applicable,Not Applicable,Not Applicable
34.0,18-24,Female,software engineering is what i'm currently doing java is my main tool of course,Student,1-3 years,Java,Not Applicable,Not Applicable,Not Applicable,5.0,garbage collection and understanding the jvm's inner workings always slow things down,"initially, i struggled a lot with understanding object-oriented concepts it took a while to click.",Not Applicable,Not Applicable,Not Applicable,Python,Python,Java,Java,Python,Python,4,Python,Not Applicable,Not Applicable,4.0,Not Applicable,Not Applicable,5.0,Not Applicable,Not Applicable,1.0,Not Applicable,Not Applicable,4.0,Not Applicable,Not Applicable,1.0,4,Python,java it's still most versatile,Not Applicable,Not Applicable,Not Applicable,Not Applicable,Not Applicable,Not Applicable,Not Applicable,Not Applicable,Not Applicable,Not Applicable,Not Applicable
35.0,18-24,Male,software development mostly java based that is what i do currently for a living,Student,Less than 1 year,Java,Not Applicable,Not Applicable,Not Applicable,1.0,garbage collection tuning and understanding jvm behavior is tough sometimes,getting the hang of all those oop concepts and the sheer verbosity initially was tough,Not Applicable,Not Applicable,Not Applicable,Python,Python,Python,Java,Java,Python,2,Python,Not Applicable,Not Applicable,1.0,Not Applicable,Not Applicable,5.0,Not Applicable,Not Applicable,3.0,Not Applicable,Not Applicable,2.0,Not Applicable,Not Applicable,1.0,4,Python,java is my choice its versatility really helps,Not Applicable,Not Applicable,Not Applicable,Not Applicable,Not Applicable,Not Applicable,Not Applicable,Not Applicable,Not Applicable,Not Applicable,Not Applicable
41.0,18-24,Male,software development is my primary gig mostly backend stuff using java so i guess that's my job field,Student,Less than 1 year,Java,Not Applicable,Not Applicable,Not Applicable,5.0,hotspot jvm's quirks and garbage collection overhead can make squeezing every last bit of speed out frustratingly difficult,honestly java's verbose syntax and the steep learning curve of its complex ecosystem initially felt overwhelming for me,Not Applicable,Not Applicable,Not Applicable,Python,Python,Python,Python,Java,Java,3,Python,Not Applicable,Not Applicable,4.0,Not Applicable,Not Applicable,5.0,Not Applicable,Not Applicable,2.0,Not Applicable,Not Applicable,4.0,Not Applicable,Not Applicable,3.0,4,Python,java probably has the best mix of stability and industry support for the long haul that's my pick,Not Applicable,Not Applicable,Not Applicable,Not Applicable,Not Applicable,Not Applicable,Not Applicable,Not Applicable,Not Applicable,Not Applicable,Not Applicable
42.0,18-24,Female,software development i work mostly with java in my day to day tasks building applications and working on diverse projects pretty much all the time,Student,1-3 years,Java,Not Applicable,Not Applicable,Not Applicable,4.0,garbage collection consistently trips me up and figuring out the best way to use threads is always a puzzle for me,dealing with java's verbosity at first felt unnecessarily complicated compared to other languages i've tried,Not Applicable,Not Applicable,Not Applicable,Python,Python,Python,Java,R,Java,3,Python,Not Applicable,Not Applicable,1.0,Not Applicable,Not Applicable,1.0,Not Applicable,Not Applicable,3.0,Not Applicable,Not Applicable,4.0,Not Applicable,Not Applicable,1.0,4,Python,java is versatile and lets me build anything i want,Not Applicable,Not Applicable,Not Applicable,Not Applicable,Not Applicable,Not Applicable,Not Applicable,Not Applicable,Not Applicable,Not Applicable,Not Applicable
44.0,18-24,Male,software engineering is my field right now i primarily work with java for various backend systems and projects,Student,Less than 1 year,Java,Not Applicable,Not Applicable,Not Applicable,5.0,dealing with garbage collection and memory leaks is the biggest pain point with java performance currently,honestly getting used to all the boilerplate code and understanding the class structure was a real struggle at first i'd say,Not Applicable,Not Applicable,Not Applicable,Java,Python,R,Java,Python,R,3,It depends,Not Applicable,Not Applicable,4.0,Not Applicable,Not Applicable,4.0,Not Applicable,Not Applicable,2.0,Not Applicable,Not Applicable,1.0,Not Applicable,Not Applicable,4.0,4,Python,java lets me handle everything,Not Applicable,Not Applicable,Not Applicable,Not Applicable,Not Applicable,Not Applicable,Not Applicable,Not Applicable,Not Applicable,Not Applicable,Not Applicable
49.0,18-24,Female,software development is my current job so naturally i'm working with java doing web applications and backend stuff it's pretty cool,Student,1-3 years,Java,Not Applicable,Not Applicable,Not Applicable,5.0,memory management and garbage collection definitely make java performance tuning pretty tricky sometimes,memory management and understanding the object oriented stuff were the biggest hurdles for me,Not Applicable,Not Applicable,Not Applicable,Python,R,Python,Java,Python,R,1,It depends,Not Applicable,Not Applicable,2.0,Not Applicable,Not Applicable,2.0,Not Applicable,Not Applicable,3.0,Not Applicable,Not Applicable,1.0,Not Applicable,Not Applicable,4.0,4,Python,java its mature robust ecosystem makes it ideal for various projects i prefer,Not Applicable,Not Applicable,Not Applicable,Not Applicable,Not Applicable,Not Applicable,Not Applicable,Not Applicable,Not Applicable,Not Applicable,Not Applicable
52.0,18-24,Male,software engineering is my main focus right now using java for most of my projects and daily work tasks its pretty good.,Student,1-3 years,Java,Not Applicable,Not Applicable,Not Applicable,4.0,here's my response:  garbage collection overhead and understanding the jvm internals can really hinder java performance optimization efforts it's tough,memory management and generics were tough at first,Not Applicable,Not Applicable,Not Applicable,Python,Python,Java,Python,Python,Java,4,Python,Not Applicable,Not Applicable,2.0,Not Applicable,Not Applicable,3.0,Not Applicable,Not Applicable,5.0,Not Applicable,Not Applicable,3.0,Not Applicable,Not Applicable,3.0,4,Python,java i would pick it still for most things i work with its what i know best.,Not Applicable,Not Applicable,Not Applicable,Not Applicable,Not Applicable,Not Applicable,Not Applicable,Not Applicable,Not Applicable,Not Applicable,Not Applicable
57.0,18-24,Female,software engineering currently java is my main focus area,Student,1-3 years,Java,Not Applicable,Not Applicable,Not Applicable,5.0,garbage collection is always a pain and sometimes figuring out the right jvm flags is tricky,dealing with the verbose syntax was tough,Not Applicable,Not Applicable,Not Applicable,Python,Python,Java,Java,Python,Python,2,Python,Not Applicable,Not Applicable,5.0,Not Applicable,Not Applicable,2.0,Not Applicable,Not Applicable,3.0,Not Applicable,Not Applicable,5.0,Not Applicable,Not Applicable,5.0,5,Python,java for everything i guess,Not Applicable,Not Applicable,Not Applicable,Not Applicable,Not Applicable,Not Applicable,Not Applicable,Not Applicable,Not Applicable,Not Applicable,Not Applicable
58.0,18-24,Female,software development is my current work using java primarily these days,Student,1-3 years,Java,Not Applicable,Not Applicable,Not Applicable,1.0,garbage collection and memory management definitely slow things down in java code finding bottlenecks is another tough one.,understanding object-oriented concepts and the verbose syntax was the toughest part,Not Applicable,Not Applicable,Not Applicable,Python,Python,Python,Java,Java,Java,3,It depends,Not Applicable,Not Applicable,2.0,Not Applicable,Not Applicable,4.0,Not Applicable,Not Applicable,1.0,Not Applicable,Not Applicable,3.0,Not Applicable,Not Applicable,3.0,1,R,java all the way its versatility and robust ecosystem are hard to beat plus i know it best,Not Applicable,Not Applicable,Not Applicable,Not Applicable,Not Applicable,Not Applicable,Not Applicable,Not Applicable,Not Applicable,Not Applicable,Not Applicable
62.0,18-24,Female,"currently, i'm working in software development building applications mostly using the java language.",Student,1-3 years,Java,Not Applicable,Not Applicable,Not Applicable,1.0,memory management and garbage collection plus figuring out the right jvm flags are frequent struggles i have,dealing with java's verbosity and the sometimes confusing error messages was hard.,Not Applicable,Not Applicable,Not Applicable,Python,Python,Python,Java,Python,Python,1,It depends,Not Applicable,Not Applicable,2.0,Not Applicable,Not Applicable,2.0,Not Applicable,Not Applicable,3.0,Not Applicable,Not Applicable,5.0,Not Applicable,Not Applicable,2.0,4,Python,java is the safest bet always,Not Applicable,Not Applicable,Not Applicable,Not Applicable,Not Applicable,Not Applicable,Not Applicable,Not Applicable,Not Applicable,Not Applicable,Not Applicable
65.0,18-24,Female,software development using java professionally of course,Student,1-3 years,Java,Not Applicable,Not Applicable,Not Applicable,1.0,memory management and garbage collection tuning definitely cause me some headaches sometimes,memory management was initially quite tricky,Not Applicable,Not Applicable,Not Applicable,Python,Java,Java,Java,Java,R,2,Python,Not Applicable,Not Applicable,4.0,Not Applicable,Not Applicable,3.0,Not Applicable,Not Applicable,4.0,Not Applicable,Not Applicable,5.0,Not Applicable,Not Applicable,1.0,4,Java,java is my clear long-term pick,Not Applicable,Not Applicable,Not Applicable,Not Applicable,Not Applicable,Not Applicable,Not Applicable,Not Applicable,Not Applicable,Not Applicable,Not Applicable
67.0,18-24,Male,software development is my career now using java for most of my coding work lately,Data Scientist,7+ years,Java,Not Applicable,Not Applicable,Not Applicable,1.0,garbage collection is often a pain alongside figuring out the best way to utilize all those threads,the verbosity was a hurdle also understanding all the different libraries at first proved tricky good stuff overall though,Not Applicable,Not Applicable,Not Applicable,Python,R,Python,Python,Python,R,4,It depends,Not Applicable,Not Applicable,4.0,Not Applicable,Not Applicable,5.0,Not Applicable,Not Applicable,2.0,Not Applicable,Not Applicable,5.0,Not Applicable,Not Applicable,1.0,3,Python,java is my pick i guess i'm comfortable and have experience it's a solid choice for most things i do,Not Applicable,Not Applicable,Not Applicable,Not Applicable,Not Applicable,Not Applicable,Not Applicable,Not Applicable,Not Applicable,Not Applicable,Not Applicable
68.0,18-24,Female,software development my primary job involving java and related tech,Student,1-3 years,Java,Not Applicable,Not Applicable,Not Applicable,5.0,garbage collection memory management is always painful,finding the right balance between all the java frameworks was quite a hurdle for me,Not Applicable,Not Applicable,Not Applicable,Python,Java,Python,Java,Java,Python,2,Python,Not Applicable,Not Applicable,3.0,Not Applicable,Not Applicable,2.0,Not Applicable,Not Applicable,4.0,Not Applicable,Not Applicable,2.0,Not Applicable,Not Applicable,3.0,5,Python,java would be my pick i know its ecosystem best and it can handle basically anything so i am sticking with it,Not Applicable,Not Applicable,Not Applicable,Not Applicable,Not Applicable,Not Applicable,Not Applicable,Not Applicable,Not Applicable,Not Applicable,Not Applicable
70.0,18-24,Female,software development is where i'm currently employed for sure,Student,1-3 years,Java,Not Applicable,Not Applicable,Not Applicable,5.0,garbage collection is always a pain alongside dealing with memory leaks and tricky threading issues i would say.,seed: 12642 getting used to the verbose syntax and understanding the class hierarchy was definitely tricky at first,Not Applicable,Not Applicable,Not Applicable,Python,Java,Java,Java,R,Python,3,It depends,Not Applicable,Not Applicable,2.0,Not Applicable,Not Applicable,5.0,Not Applicable,Not Applicable,4.0,Not Applicable,Not Applicable,5.0,Not Applicable,Not Applicable,2.0,3,Python,java i guess its versatility and ecosystem are hard to replace so i'd stick with it for future projects,Not Applicable,Not Applicable,Not Applicable,Not Applicable,Not Applicable,Not Applicable,Not Applicable,Not Applicable,Not Applicable,Not Applicable,Not Applicable
72.0,18-24,Male,software development is my gig i use java for a variety of projects daily for my current role,Student,1-3 years,Java,Not Applicable,Not Applicable,Not Applicable,5.0,managing garbage collection and understanding bytecode optimization are consistently my biggest java performance roadblocks for sure,honestly the steep learning curve and dealing with its verbose syntax were quite difficult at first,Not Applicable,Not Applicable,Not Applicable,Python,Python,Java,Java,Python,Python,2,Python,Not Applicable,Not Applicable,1.0,Not Applicable,Not Applicable,1.0,Not Applicable,Not Applicable,3.0,Not Applicable,Not Applicable,2.0,Not Applicable,Not Applicable,4.0,5,Python,java is the safest bet always honestly,Not Applicable,Not Applicable,Not Applicable,Not Applicable,Not Applicable,Not Applicable,Not Applicable,Not Applicable,Not Applicable,Not Applicable,Not Applicable
78.0,18-24,Male,software development is what i do now mostly java based applications of course,Student,1-3 years,Java,Not Applicable,Not Applicable,Not Applicable,1.0,garbage collection's unpredictable pauses and memory leaks definitely make java performance tuning a struggle sometimes,the verbose syntax and strict typing initially caused me a lot of frustration honestly.,Not Applicable,Not Applicable,Not Applicable,Python,Python,Python,Python,Java,Python,2,Python,Not Applicable,Not Applicable,5.0,Not Applicable,Not Applicable,3.0,Not Applicable,Not Applicable,4.0,Not Applicable,Not Applicable,1.0,Not Applicable,Not Applicable,1.0,2,Java,java i guess familiarity matters and i already know its ins and outs the best.,Not Applicable,Not Applicable,Not Applicable,Not Applicable,Not Applicable,Not Applicable,Not Applicable,Not Applicable,Not Applicable,Not Applicable,Not Applicable
91.0,18-24,Female,software development using java is my everyday thing at the moment,Student,Less than 1 year,Java,Not Applicable,Not Applicable,Not Applicable,4.0,garbage collection and memory management always gives trouble,getting the hang of object-oriented concepts and the overly verbose syntax was pretty tough at first really,Not Applicable,Not Applicable,Not Applicable,Python,Python,Python,Java,Python,R,3,Python,Not Applicable,Not Applicable,4.0,Not Applicable,Not Applicable,3.0,Not Applicable,Not Applicable,5.0,Not Applicable,Not Applicable,5.0,Not Applicable,Not Applicable,4.0,2,Python,java's the pick for me its versatility and strong ecosystem make it a solid foundation for almost anything really,Not Applicable,Not Applicable,Not Applicable,Not Applicable,Not Applicable,Not Applicable,Not Applicable,Not Applicable,Not Applicable,Not Applicable,Not Applicable
96.0,18-24,Female,software development is my current profession for sure,Student,1-3 years,Java,Not Applicable,Not Applicable,Not Applicable,3.0,garbage collection is always a headache and hard to precisely control,understanding object oriented concepts was tough,Not Applicable,Not Applicable,Not Applicable,Python,Java,R,Python,Java,R,2,Python,Not Applicable,Not Applicable,5.0,Not Applicable,Not Applicable,1.0,Not Applicable,Not Applicable,1.0,Not Applicable,Not Applicable,4.0,Not Applicable,Not Applicable,1.0,2,Python,java for sure it's versatile reliable and i know it best,Not Applicable,Not Applicable,Not Applicable,Not Applicable,Not Applicable,Not Applicable,Not Applicable,Not Applicable,Not Applicable,Not Applicable,Not Applicable
104.0,18-24,Male,software development is my current job i use java for most projects at work,Student,1-3 years,Java,Not Applicable,Not Applicable,Not Applicable,1.0,garbage collection is tricky and memory leaks are always a worry,dealing with the verbosity was tough going,Not Applicable,Not Applicable,Not Applicable,Python,Python,Python,Java,Python,R,2,Python,Not Applicable,Not Applicable,4.0,Not Applicable,Not Applicable,1.0,Not Applicable,Not Applicable,1.0,Not Applicable,Not Applicable,2.0,Not Applicable,Not Applicable,4.0,3,Python,java because i already know it best and it seems most versatile for many things,Not Applicable,Not Applicable,Not Applicable,Not Applicable,Not Applicable,Not Applicable,Not Applicable,Not Applicable,Not Applicable,Not Applicable,Not Applicable
