228.0,18-24,Female,software development is what i do so i'm a programmer using java mostly building applications that are actually useful,Student,1-3 years,Java,Not Applicable,Not Applicable,Not Applicable,5.0,garbage collection is always a headache and so is dealing with memory leaks ugh,grasping the intricacies of the inheritance and generics was a struggle initially,Not Applicable,Not Applicable,Not Applicable,Python,Python,Java,Python,Python,Python,4,Python,Not Applicable,Not Applicable,1.0,Not Applicable,Not Applicable,3.0,Not Applicable,Not Applicable,4.0,Not Applicable,Not Applicable,4.0,Not Applicable,Not Applicable,5.0,4,Python,java's a solid choice i'd stick with it for versatility and job prospects,Not Applicable,Not Applicable,Not Applicable,Not Applicable,Not Applicable,Not Applicable,Not Applicable,Not Applicable,Not Applicable,Not Applicable,Not Applicable
231.0,18-24,Female,software development that's my gig,Student,1-3 years,Java,Not Applicable,Not Applicable,Not Applicable,3.0,garbage collection's unpredictability and figuring out hotspots in complex java applications are my biggest hurdles,understanding all the class hierarchy was hard,Not Applicable,Not Applicable,Not Applicable,Python,Python,Python,Java,Python,Python,4,Python,Not Applicable,Not Applicable,2.0,Not Applicable,Not Applicable,2.0,Not Applicable,Not Applicable,2.0,Not Applicable,Not Applicable,5.0,Not Applicable,Not Applicable,3.0,5,Python,java for sure its what i know best and gets the job done,Not Applicable,Not Applicable,Not Applicable,Not Applicable,Not Applicable,Not Applicable,Not Applicable,Not Applicable,Not Applicable,Not Applicable,Not Applicable
236.0,18-24,Male,computer science student heavily focused on software development using java,Student,1-3 years,Java,Not Applicable,Not Applicable,Not Applicable,5.0,garbage collection tuning and memory leaks always slow things down sometimes,dealing with the verbose syntax and the intricacies of the class system was hard,Not Applicable,Not Applicable,Not Applicable,Python,Java,Python,Java,Java,R,4,Python,Not Applicable,Not Applicable,2.0,Not Applicable,Not Applicable,1.0,Not Applicable,Not Applicable,1.0,Not Applicable,Not Applicable,4.0,Not Applicable,Not Applicable,2.0,5,Python,java all the way i know it,Not Applicable,Not Applicable,Not Applicable,Not Applicable,Not Applicable,Not Applicable,Not Applicable,Not Applicable,Not Applicable,Not Applicable,Not Applicable
239.0,18-24,Female,software engineering is what i am currently employed in i mostly code in java,Student,1-3 years,Java,Not Applicable,Not Applicable,Not Applicable,3.0,garbage collection overhead and memory leaks really slow things down,okay here's the response:  memory management and understanding the complex class hierarchy were tough java hurdles early on for me,Not Applicable,Not Applicable,Not Applicable,Python,Python,Java,Python,Python,R,2,Python,Not Applicable,Not Applicable,2.0,Not Applicable,Not Applicable,4.0,Not Applicable,Not Applicable,3.0,Not Applicable,Not Applicable,2.0,Not Applicable,Not Applicable,2.0,3,Python,java its my go-to for most things plus the ecosystem is massive and reliable for various projects i'm working on,Not Applicable,Not Applicable,Not Applicable,Not Applicable,Not Applicable,Not Applicable,Not Applicable,Not Applicable,Not Applicable,Not Applicable,Not Applicable
240.0,18-24,Female,software development i mainly use java day to day,Student,Less than 1 year,Java,Not Applicable,Not Applicable,Not Applicable,1.0,garbage collection tuning and understanding the jvm's behavior are often the trickiest hurdles for me honestly,honestly the verbosity and the complex ecosystem were really tough at first,Not Applicable,Not Applicable,Not Applicable,Python,Python,Python,Python,Python,Java,3,Python,Not Applicable,Not Applicable,4.0,Not Applicable,Not Applicable,2.0,Not Applicable,Not Applicable,1.0,Not Applicable,Not Applicable,2.0,Not Applicable,Not Applicable,1.0,3,Python,java because it handles everything and i already know it,Not Applicable,Not Applicable,Not Applicable,Not Applicable,Not Applicable,Not Applicable,Not Applicable,Not Applicable,Not Applicable,Not Applicable,Not Applicable
247.0,18-24,Male,i work in software engineering developing applications a java developer that is what i do right now,Student,7+ years,Java,Not Applicable,Not Applicable,Not Applicable,4.0,garbage collection overhead is often a killer,the initial learning curve felt steep the object-oriented concepts took some time to click and the verbosity was annoying sometimes,Not Applicable,Not Applicable,Not Applicable,All equally,Python,Java,Python,Java,Python,2,Python,Not Applicable,Not Applicable,2.0,Not Applicable,Not Applicable,5.0,Not Applicable,Not Applicable,1.0,Not Applicable,Not Applicable,5.0,Not Applicable,Not Applicable,3.0,4,Python,java is my go-to i know it well and it handles most things i need plus the ecosystem is huge,Not Applicable,Not Applicable,Not Applicable,Not Applicable,Not Applicable,Not Applicable,Not Applicable,Not Applicable,Not Applicable,Not Applicable,Not Applicable
Not Applicable,18-24,Female,Clinical pharmacists ,Student,Less than 1 year,Java,Not Applicable,Not Applicable,Not Applicable,1.0,The biggest challenge in optimizing Java performance is managing memory efficiently while balancing speed,The biggest challenge in learning Java is understanding object-oriented programming concepts,Not Applicable,Not Applicable,Not Applicable,Java,Java,Python,Python,R,R,2,Python,2.0,1.0,4.0,Not Applicable,Not Applicable,Not Applicable,Not Applicable,Not Applicable,Not Applicable,Not Applicable,Not Applicable,Not Applicable,Not Applicable,Not Applicable,Not Applicable,2,Python,Java,Not Applicable,2025/03/09 6:44:15 PM GMT+2,Java,Java,Python,Java,Java,Yes,"The biggest advantage of Java is its platform independencewrite once, run anywhere.","Yes, learning another language is beneficial because it expands problem-solving skills and adaptability.","Yes, switching languages due to project requirements happens when performance, compatibility, or specific frameworks demand it"
Not Applicable,18-24,Female,Medicine ,Student,Less than 1 year,Java,Not Applicable,Not Applicable,Not Applicable,4.0,No,No,Not Applicable,Not Applicable,Not Applicable,Java,Java,R,Java,Java,Python,2,It depends,3.0,4.0,4.0,Not Applicable,Not Applicable,Not Applicable,Not Applicable,Not Applicable,Not Applicable,Not Applicable,Not Applicable,Not Applicable,Not Applicable,Not Applicable,Not Applicable,4,Java,Java,Not Applicable,2025/03/09 7:06:57 PM GMT+2,Java,R,Java,No preference,Depends on the role,Planning to,No,Yes ,Yes
Not Applicable,18-24,Female,Student in veterinary medicine ,Student,Less than 1 year,Java,Not Applicable,Not Applicable,Not Applicable,5.0,Not Applicable,Not Applicable,Not Applicable,Not Applicable,Not Applicable,Java,Not Applicable,Java,Java,R,Java,2,Java,4.0,4.0,5.0,Not Applicable,Not Applicable,Not Applicable,Not Applicable,Not Applicable,Not Applicable,Not Applicable,Not Applicable,Not Applicable,Not Applicable,Not Applicable,Not Applicable,3,Not Applicable,Not Applicable,Not Applicable,2025/03/09 7:34:13 PM GMT+2,Not Applicable,Java,Java,Java,Java,Yes,Not Applicable,Not Applicable,Not Applicable
Not Applicable,18-24,Female,Medical student ,Student,Less than 1 year,Java,Not Applicable,Not Applicable,Not Applicable,5.0,Honestly it was easy for me ,Trying to get every point which was a lot  ,Not Applicable,Not Applicable,Not Applicable,Java,Java,Python,R,R,Java,3,It depends,4.0,3.0,4.0,Not Applicable,Not Applicable,Not Applicable,Not Applicable,Not Applicable,Not Applicable,Not Applicable,Not Applicable,Not Applicable,Not Applicable,Not Applicable,Not Applicable,4,Not Applicable,Not Applicable,Not Applicable,2025/03/09 9:29:42 PM GMT+2,Java,Java,Java,Java,Python,Yes,Not Applicable,Not Applicable,Not Applicable
Not Applicable,18-24,Male,programming,Student,1-3 years,Java,Not Applicable,Not Applicable,Not Applicable,3.0,code writing difficulty,Not Applicable,Not Applicable,Not Applicable,Not Applicable,Python,Python,Python,Python,Python,Python,3,Python,5.0,5.0,3.0,Not Applicable,Not Applicable,Not Applicable,Not Applicable,Not Applicable,Not Applicable,Not Applicable,Not Applicable,Not Applicable,Not Applicable,Not Applicable,Not Applicable,2,Python,Not Applicable,Not Applicable,2025/03/09 10:06:16 PM GMT+2,Python,Python,Python,Python,Python,No,Not Applicable,Not Applicable,Not Applicable
Not Applicable,18-24,Female,Data science ,Student,Less than 1 year,Java,Not Applicable,Not Applicable,Not Applicable,3.0,Resources of practical training ,Problem solving with it,Not Applicable,Not Applicable,Not Applicable,Python,Python,Java,Java,Python,Python,2,It depends,4.0,3.0,3.0,Not Applicable,Not Applicable,Not Applicable,Not Applicable,Not Applicable,Not Applicable,Not Applicable,Not Applicable,Not Applicable,Not Applicable,Not Applicable,Not Applicable,4,Python,Python ,Not Applicable,2025/03/10 12:27:05 AM GMT+2,Python,Python,Python,Python,Java,No,Easy to learn,C++ because it is best for hardware ,Yes due to the type of project 
Not Applicable,25-34,Male,Accounting manager ,Analyst,Less than 1 year,Java,Not Applicable,Not Applicable,Not Applicable,1.0,Not Applicable,Not Applicable,Not Applicable,Not Applicable,Not Applicable,Java,Python,R,Java,Python,Java,1,It depends,1.0,1.0,2.0,Not Applicable,Not Applicable,Not Applicable,Not Applicable,Not Applicable,Not Applicable,Not Applicable,Not Applicable,Not Applicable,Not Applicable,Not Applicable,Not Applicable,3,Python,Not Applicable,Not Applicable,2025/03/10 4:46:01 PM GMT+2,Java,Java,Python,Python,Depends on the role,Yes,Not Applicable,Not Applicable,Not Applicable
Not Applicable,18-24,Female,Computer science ,Student,1-3 years,Java,Not Applicable,Not Applicable,Not Applicable,4.0,There isn't lists ,That it's a low level programming ,Not Applicable,Not Applicable,Not Applicable,Python,Python,Java,Java,Python,R,4,Python,5.0,4.0,3.0,Not Applicable,Not Applicable,Not Applicable,Not Applicable,Not Applicable,Not Applicable,Not Applicable,Not Applicable,Not Applicable,Not Applicable,Not Applicable,Not Applicable,3,Python,Python due to its simplicity ,Not Applicable,2025/03/10 5:07:52 PM GMT+2,Python,Python,Python,Python,Java,No,Fast easy and understandable syntax,Java because it makes you understand programming and computer well,"Yes if it's a project that needs visualization or graphs , python is more useful"
Not Applicable,18-24,Male,..,Student,1-3 years,Java,Not Applicable,Not Applicable,Not Applicable,1.0,Not Applicable,Not Applicable,Not Applicable,Not Applicable,Not Applicable,Python,Python,Not Applicable,Java,Java,Python,5,It depends,1.0,1.0,1.0,Not Applicable,Not Applicable,Not Applicable,Not Applicable,Not Applicable,Not Applicable,Not Applicable,Not Applicable,Not Applicable,Not Applicable,Not Applicable,Not Applicable,1,Not Applicable,Not Applicable,Not Applicable,2025/03/10 5:12:07 PM GMT+2,Python,Python,All equally,No preference,Depends on the role,Yes,Not Applicable,Not Applicable,Not Applicable
Not Applicable,18-24,Female,Computer science ,Student,1-3 years,Java,Not Applicable,Not Applicable,Not Applicable,3.0,Not Applicable,Not Applicable,Not Applicable,Not Applicable,Not Applicable,Python,Python,Not Applicable,Not Applicable,Not Applicable,Python,4,Python,5.0,4.0,3.0,Not Applicable,Not Applicable,Not Applicable,Not Applicable,Not Applicable,Not Applicable,Not Applicable,Not Applicable,Not Applicable,Not Applicable,Not Applicable,Not Applicable,3,Not Applicable,Not Applicable,Not Applicable,2025/03/10 5:12:18 PM GMT+2,Python,Java,Python,Python,Python,No,Not Applicable,Not Applicable,Not Applicable
Not Applicable,18-24,Male,student at botsny/chemistry department-faculty of science-AUE,Student,1-3 years,Java,Not Applicable,Not Applicable,Not Applicable,4.0,memory management - garbage collection,understanding the algorithms,Not Applicable,Not Applicable,Not Applicable,All equally,Python,Java,Java,R,Python,4,It depends,4.0,5.0,4.0,Not Applicable,Not Applicable,Not Applicable,Not Applicable,Not Applicable,Not Applicable,Not Applicable,Not Applicable,Not Applicable,Not Applicable,Not Applicable,Not Applicable,4,Not Applicable,Not Applicable,Not Applicable,2025/03/10 5:57:07 PM GMT+2,Python,Python,Python,Java,Depends on the role,No,Not Applicable,Not Applicable,Not Applicable
Not Applicable,18-24,Female,Student ,Student,1-3 years,Java,Not Applicable,Not Applicable,Not Applicable,2.0,.....,.....,Not Applicable,Not Applicable,Not Applicable,Python,R,Java,Python,Java,Python,2,Java,2.0,3.0,2.0,Not Applicable,Not Applicable,Not Applicable,Not Applicable,Not Applicable,Not Applicable,Not Applicable,Not Applicable,Not Applicable,Not Applicable,Not Applicable,Not Applicable,2,R,......,Not Applicable,2025/03/10 7:54:43 PM GMT+2,Python,Python,Java,Python,R,Yes,......,.......,.......
Not Applicable,18-24,Female,Medical field,Student,Less than 1 year,Java,Not Applicable,Not Applicable,Not Applicable,1.0,Problem ,It take much time,Not Applicable,Not Applicable,Not Applicable,Java,R,R,Java,R,Python,2,R,2.0,2.0,2.0,Not Applicable,Not Applicable,Not Applicable,Not Applicable,Not Applicable,Not Applicable,Not Applicable,Not Applicable,Not Applicable,Not Applicable,Not Applicable,Not Applicable,2,R,Java,Not Applicable,2025/03/10 8:41:00 PM GMT+2,Python,Python,R,No preference,Depends on the role,Yes,It is easy,Yes,No
Not Applicable,18-24,Male,Math Teacher,Student,Less than 1 year,Java,Not Applicable,Not Applicable,Not Applicable,3.0,1. Identifying Performance Bottlenecks 2. Understanding JVM Internals 3. Managing Memory and Garbage Collection 4. Optimizing Multithreading and Concurrency 5. Dealing with External Dependencies and Legacy Code 6. Measuring and Monitoring Performance 7. Balancing Performance and Other Non-Functional Requirements 8. Staying Up-to-Date with JVM and Java Language Evolution 9. Managing Complexity and Technical Debt 10. Communicating Performance Optimization Strategies and Results,1. Understanding Object-Oriented Programming 2. Learning Java Syntax and Semantics 3. Mastering Java Libraries and Frameworks,Not Applicable,Not Applicable,Not Applicable,Python,Java,R,Python,R,Java,3,R,3.0,3.0,3.0,Not Applicable,Not Applicable,Not Applicable,Not Applicable,Not Applicable,Not Applicable,Not Applicable,Not Applicable,Not Applicable,Not Applicable,Not Applicable,Not Applicable,3,Python,"As a conversational AI, I don't have personal preferences or opinions, but I can provide an analysis of the three languages.  If I had to choose one language for all future projects, I would choose *Python*. Here's why:  1. *Versatility*: Python can be used for a wide range of applications, including web development, data analysis, artificial intelligence, scientific computing, and more. 2. *Ease of use*: Python has a simple syntax and is relatively easy to learn, making it a great language for beginners and experienced developers alike. 3. *Large community*: Python has a massive and active community, which means there are many resources available, including libraries, frameworks, and tutorials. 4. *Cross-platform*: Python can run on multiple operating systems, including Windows, macOS, and Linux. 5. *Extensive libraries*: Python has a vast collection of libraries and frameworks that make",Not Applicable,2025/03/11 12:39:37 AM GMT+2,Python,Python,Python,Java,Python,No,"As a conversational AI, I don't have personal preferences, but I can tell you about the advantages of various programming languages.  Here are some biggest advantages of popular programming languages:  1. *Python*: Easy to learn, versatile, and large community support. 2. *Java*: Platform independence, strong security features, and vast ecosystem of libraries. 3. *JavaScript*: Ubiquity in web development, dynamic nature, and extensive use in mobile and desktop applications. 4. *C++*: High performance, control over hardware resources, and reliability.  Each language has its unique strengths, and the choice ultimately depends on the specific needs of a project.","Learning another programming language can be incredibly beneficial. Here's why:  1. *Broadened perspectives*: Learning another language exposes you to new programming paradigms, data structures, and problem-solving approaches. 2. *Improved problem-solving skills*: Familiarity with multiple languages helps you develop a more nuanced understanding of programming concepts and enhances your ability to tackle complex problems. 3. *Enhanced career opportunities*: Knowing multiple languages makes you a more versatile and attractive candidate to potential employers. 4. *Cross-language inspiration*: Learning another language can inspire new ideas and approaches in your primary language. 5. *Staying adaptable in a changing landscape*: The programming landscape is constantly evolving. Learning another language helps you stay adaptable and prepared for new technologies and trends.  When choosing another language to learn, consider:  1. *Your goals*: Align the language with your career aspirations or personal projects. 2. *Similarities and differences*: Choose a language that complements your existing skills or challenges you to think differently. 3. *Community support*: Opt for languages with active communities, extensive documentation, and readily available resources.  Remember, learning another language takes time and dedication. Focus on building a strong foundation, and gradually expand your skills.","As a conversational AI, I don't have personal experiences or work on projects in the classical sense. However, I can provide insights on why developers might need to switch between languages due to project requirements:  1. *Project requirements*: Different projects may require specific languages due to factors like platform, performance, or legacy system integration. 2. *Client or company preferences*: Clients or companies may have specific language preferences or requirements, driving the need for developers to switch. 3. *Legacy system maintenance*: Developers may need to work on legacy systems written in older languages, requiring them to switch. 4. *New technology adoption*: As new technologies emerge, developers may need to switch to languages that better support those technologies. 5. *Team or project constraints*: Team composition, project timelines, or resource constraints may necessitate a language switch.  Developers may need to adapt to new languages due to these factors, which can be challenging but also opportunities for growth and learning."
Not Applicable,18-24,Male,Cyber security ,Student,1-3 years,Java,Not Applicable,Not Applicable,Not Applicable,3.0,Loop,Variable ,Not Applicable,Not Applicable,Not Applicable,Python,Java,Python,Python,Python,R,2,Python,1.0,2.0,2.0,Not Applicable,Not Applicable,Not Applicable,Not Applicable,Not Applicable,Not Applicable,Not Applicable,Not Applicable,Not Applicable,Not Applicable,Not Applicable,Not Applicable,2,Python,R,Not Applicable,2025/03/11 1:06:55 AM GMT+2,R,Java,Java,R,R,Yes,Applying program ,JavaScript ,Yes
Not Applicable,18-24,Female,Data Science,Student,1-3 years,Java,Not Applicable,Not Applicable,Not Applicable,5.0,Not Applicable,Not Applicable,Not Applicable,Not Applicable,Not Applicable,Java,Python,Python,Java,Java,Python,2,It depends,4.0,4.0,4.0,Not Applicable,Not Applicable,Not Applicable,Not Applicable,Not Applicable,Not Applicable,Not Applicable,Not Applicable,Not Applicable,Not Applicable,Not Applicable,Not Applicable,5,Python,Java,Not Applicable,2025/03/11 5:12:44 PM GMT+2,Java,Python,Python,Java,Python,No,Not Applicable,Not Applicable,Not Applicable
